Of course, recognizing our common humanity is only the beginning of our task. Words alone cannot meet the needs of our people. These needs will be met only if we act boldly in the years ahead; and if we understand that the challenges we face are shared, and our failure to meet them will hurt us all.	Certes, notre tâche commence seulement quand nous avons pris conscience de notre humanité commune. Ce n'est pas par des paroles que nous pouvons répondre aux besoins de nos peuples. Nous ne pourrons les satisfaire qu'à condition d'agir avec audace dans les années à venir et de comprendre que nous nous heurtons à des défis communs et qu'en nous abstenant d'y faire face c'est à nous tous que nous faisons tort.	Por supuesto, el reconocimiento de nuestra humanidad común es apenas el comienzo de nuestra tarea. Las palabras por sí solas no satisfacen las necesidades de nuestros pueblos. Estas necesidades solo se satisfacerán si actuamos audazmente en los próximos años. Y debemos actuar con el entendimiento de que la gente en todo el mundo enfrenta los mismos desafíos, y si fracasamos, las consecuencias nos perjudicarán a todos.
For we have learned from recent experience that when a financial system weakens in one country, prosperity is hurt everywhere. When a new flu infects one human being, all are at risk. When one nation pursues a nuclear weapon, the risk of nuclear attack rises for all nations. When violent extremists operate in one stretch of mountains, people are endangered across an ocean. When innocents in Bosnia and Darfur are slaughtered, that is a stain on our collective conscience. (Applause.) That is what it means to share this world in the 21st century. That is the responsibility we have to one another as human beings.	Car nous en avons fait récemment l'expérience : quand le système financier d'un pays particulier s'affaiblit, la prospérité est mise à mal partout. Quand une nouvelle grippe infecte un seul être humain, nous courons tous un risque. Quand un pays particulier tente de se doter d'une arme nucléaire, le risque d'attaque nucléaire augmente dans toutes les nations. Quand des extrémistes violents sévissent dans une certaine région de montagnes, les populations situées par-delà l'océan sont mises en danger. Et quand des innocents en Bosnie et au Darfour sont massacrés, c'est notre conscience collective qui est souillée. (Applaudissements) Vivre ensemble dans le monde, voilà ce que cela signifie au vingt et unième siècle. C'est la responsabilité que nous avons les uns envers les autres en tant qu'êtres humains.	Pues hemos aprendido de acontecimientos recientes que cuando un sistema financiero se debilita en un país, hay menos prosperidad en todas partes. Cuando una nueva gripe infecta a un ser humano, todos estamos en peligro. Cuando una nación procura armas nucleares, todas las naciones corren mayor riesgo de un ataque nuclear. Cuando extremistas violentos operan en una franja montañosa, el peligro se cierne sobre gente al otro lado del océano. Y cuando personas inocentes en Bosnia y en Darfur son asesinados, sentimos un peso en nuestra conciencia colectiva. Eso es lo que significa compartir este mundo en el siglo XXI. Somos mutuamente responsables ante los demás seres humanos.
And this is a difficult responsibility to embrace. For human history has often been a record of nations and tribes -- and, yes, religions -- subjugating one another in pursuit of their own interests. Yet in this new age, such attitudes are self-defeating. Given our interdependence, any world order that elevates one nation or group of people over another will inevitably fail. So whatever we think of the past, we must not be prisoners to it. Our problems must be dealt with through partnership; our progress must be shared. (Applause.)	C'est une responsabilité difficile à assumer. Car l'histoire de l'humanité est trop souvent le récit de nations et de tribus - et admettons-le, de religions - qui s'asservissent en visant leur propre intérêt. Mais dans cette ère nouvelle, une telle attitude est autodestructrice. Au vu de notre interdépendance, tout ordre mondial qui élève un pays ou un groupe d'individus au détriment d'un autre est inévitablement voué à l'échec. Quelle que soit notre opinion du passé, nous ne devons pas en être prisonniers. Nous devons régler nos problèmes par le biais du partenariat et partager nos progrès. (Applaudissements)	Ésa es una responsabilidad difícil de asumir. Ya que la historia de la humanidad ha sido a menudo una letanía de naciones y tribus que subyugan a otras para satisfacer sus propios intereses. Sin embargo, en esta nueva era, semejantes actitudes son contraproducentes. Debido a nuestra interdependencia, cualquier régimen en el mundo que eleve a una nación o grupo humano por encima de otro inevitablemente fracasará. Así que cualquiera sea nuestra opinión del pasado, no debemos ser prisioneros de él. Debemos solucionar nuestros problemas colaborando, debemos compartir nuestro progreso.
Now, that does not mean we should ignore sources of tension. Indeed, it suggests the opposite: We must face these tensions squarely. And so in that spirit, let me speak as clearly and as plainly as I can about some specific issues that I believe we must finally confront together.	Il ne faut pas en conclure que nous devrions faire sembler d'ignorer les sources de tension. C'est l'inverse qui nous est suggéré : nous devons affronter carrément ces tensions. Dans cet esprit, permettez-moi de m'exprimer aussi clairement et aussi simplement que possible sur certaines questions précises auxquelles nous devons maintenant faire face ensemble.	Eso no significa que debemos ignorar las fuentes de tensión. De hecho, sugiere que debemos hacer exactamente lo contrario: debemos enfrentar estas tensiones de frente. Y con esa intención, permítanme hablar de la manera más clara y transparente posible sobre algunos asuntos específicos que creo que debemos finalmente enfrentar juntos.
The first issue that we have to confront is violent extremism in all of its forms.	La première est celle de l'extrémisme violent sous toutes ses formes.	Lo primero que debemos encarar es el extremismo violento en todas sus formas.
In Ankara, I made clear that America is not -- and never will be -- at war with Islam. (Applause.) We will, however, relentlessly confront violent extremists who pose a grave threat to our security -- because we reject the same thing that people of all faiths reject: the killing of innocent men, women, and children. And it is my first duty as President to protect the American people.	À Ankara, j'ai fait clairement savoir que l'Amérique n'est pas - et ne sera jamais - en guerre contre l'islam. (Applaudissements) En revanche, nous affronterons inlassablement les extrémistes violents qui font peser une menace grave sur notre sécurité. Parce que nous rejetons ce que rejettent les gens de toutes confessions : le meurtre d'hommes, de femmes et d'enfants innocents. Et il m'incombe d'abord, en tant que président, de protéger le peuple américain.	En Ankara, dejé en claro que Estados Unidos no está y nunca estará en guerra contra el Islam. Sin embargo, les haremos frente sin descanso a los extremistas violentos que representan una grave amenaza para nuestra seguridad, porque rechazamos lo mismo que rechaza la gente de todos los credos: el asesinato de hombres, mujeres y niños inocentes. Y es mi deber principal como Presidente proteger al pueblo estadounidense.
The situation in Afghanistan demonstrates America's goals, and our need to work together. Over seven years ago, the United States pursued al Qaeda and the Taliban with broad international support. We did not go by choice; we went because of necessity. I'm aware that there's still some who would question or even justify the events of 9/11. But let us be clear: Al Qaeda killed nearly 3,000 people on that day. The victims were innocent men, women and children from America and many other nations who had done nothing to harm anybody. And yet al Qaeda chose to ruthlessly murder these people, claimed credit for the attack, and even now states their determination to kill on a massive scale. They have affiliates in many countries and are trying to expand their reach. These are not opinions to be debated; these are facts to be dealt with.	La situation qui prévaut en Afghanistan illustre les objectifs de l'Amérique et la nécessité de collaborer tous ensemble. Voilà maintenant plus de sept ans, forts d'un large appui de la communauté internationale, les États-Unis ont donné la chasse à al-Qaïda et aux talibans. Nous avons agi de la sorte non par choix, mais par nécessité. Je suis conscient que d'aucuns mettent encore en question ou même justifient les événements du 11 Septembre. Mais soyons clairs : Al-Qaïda a tué près de trois mille personnes ce jour-là. Ses victimes étaient des hommes, des femmes et des enfants innocents, venus d'Amérique et de beaucoup d'autres pays, et qui n'avaient rien fait à personne. Mais al-Qaïda a choisi de les tuer sans merci, de revendiquer les attentats et il réaffirme aujourd'hui encore sa détermination à commettre d'autres meurtres à une échelle massive. Ce réseau a des membres dans de nombreux pays et il essaie d'élargir son rayon d'action. Il ne s'agit pas là d'opinions à débattre - ce sont des faits à combattre.	La situación en Afganistán demuestra las metas de Estados Unidos y nuestra necesidad de trabajar juntos. Hace más de siete años, Estados Unidos tenía amplio apoyo internacional cuando fue en pos de Al Qaida y el Talibán. Ir allá no fue una opción; fue una necesidad. Y estoy consciente de que hay quienes cuestionan o justifican los acontecimientos del 11 de septiembre. Pero seamos claros: Al Qaida asesinó a casi 3,000 personas ese día. Las víctimas fueron hombres, mujeres y niños inocentes de los Estados Unidos y muchos otros países que no habían hecho nada para hacerle daño a nadie. Y sin embargo, Al Qaida los asesinó sin misericordia, se adjudicó responsabilidad por el ataque y aún ahora sigue declarando repetidamente su determinación de asesinar a gran escala. Tienen militantes en muchos países y están tratando de ampliar su alcance. Éstas no son opiniones para debatir, son hechos que debemos afrontar.
Now, make no mistake: We do not want to keep our troops in Afghanistan. We see no military -- we seek no military bases there. It is agonizing for America to lose our young men and women. It is costly and politically difficult to continue this conflict. We would gladly bring every single one of our troops home if we could be confident that there were not violent extremists in Afghanistan and now Pakistan determined to kill as many Americans as they possibly can. But that is not yet the case.	Eh bien, ne vous y trompez pas : nous ne voulons pas laisser nos soldats en Afghanistan. Nous ne cherchons pas - nous ne cherchons pas à y établir des bases militaires. Il nous est douloureux pour l'Amérique de perdre ses jeunes gens et ses jeunes femmes. La poursuite de ce conflit s'avère coûteuse et politiquement difficile. Nous ne demanderions pas mieux que de rapatrier tous nos soldats, jusqu'au dernier, si nous avions l'assurance que l'Afghanistan et maintenant le Pakistan n'abritaient pas d'éléments extrémistes déterminés à tuer le plus grand nombre possible d'Américains. Mais ce n'est pas encore le cas.	Y que quede claro: no queremos mantener a nuestras tropas en Afganistán. No queremos tener bases militares allá. Es doloroso para los Estados Unidos perder a nuestros jóvenes. Continuar este conflicto tiene un costo político y económico muy alto. De muy buena gana enviaríamos de regreso a casa a todas nuestras tropas si tuviéramos la certeza de que no hay extremistas violentos en Afganistán y Pakistán decididos a asesinar a todos los estadounidenses que puedan. Pero esa aún no es la situación.
And that's why we're partnering with a coalition of 46 countries. And despite the costs involved, America's commitment will not weaken. Indeed, none of us should tolerate these extremists. They have killed in many countries. They have killed people of different faiths -- but more than any other, they have killed Muslims. Their actions are irreconcilable with the rights of human beings, the progress of nations, and with Islam. The Holy Koran teaches that whoever kills an innocent is as -- it is as if he has killed all mankind. (Applause.) And the Holy Koran also says whoever saves a person, it is as if he has saved all mankind. (Applause.) The enduring faith of over a billion people is so much bigger than the narrow hatred of a few. Islam is not part of the problem in combating violent extremism -- it is an important part of promoting peace.	C'est pourquoi nous œuvrons en partenariat avec une coalition de 46 pays. Malgré les couts en cause, la volonté de l'Amérique ne va pas fléchir. Assurément, aucun d'entre nous ne doit tolérer ces éléments extrémistes. Ils ont fait des morts dans beaucoup de pays. Ils ont tué des gens de toutes religions - et surtout des musulmans. Leurs actions sont irréconciliables avec les droits de l'homme, le progrès des nations et l'islam. Le Saint Coran nous enseigne que quiconque tue un innocent tue l'humanité tout entière, (Applaudissements) et que quiconque sauve quelqu'un, sauve l'humanité tout entière. (Applaudissements) La foi enracinée de plus d'un milliard d'habitants de la planète est tellement plus vaste que la haine étroite de quelques-uns. Quand il s'agit de combattre l'extrémisme violent, l'islam ne fait pas partie du problème - il constitue une partie importante de la marche vers la paix.	Por eso estamos trabajando con una coalición de cuarenta y seis países. Y a pesar de los costos requeridos, el compromiso de los Estados Unidos no se debilitará. De hecho, ninguno de nosotros debe tolerar a estos extremistas. Han cometido asesinatos en muchos países. Han asesinado a gente de diferentes religiones, y más que nada, han asesinado a musulmanes. Sus actos son irreconciliables con los derechos de los seres humanos, el progreso de las naciones y el Islam. El Sagrado Corán enseña que quien mata a un inocente, mata a toda la humanidad; y quien salva a una persona, salva a toda la humanidad. La religión perdurable de más de mil millones de personas es mucho más fuerte que el odio intransigente de unos pocos. Islam no es parte del problema en la lucha contra el extremismo violento, es parte importante de avanzar la paz.
Now, we also know that military power alone is not going to solve the problems in Afghanistan and Pakistan. That's why we plan to invest $1.5 billion each year over the next five years to partner with Pakistanis to build schools and hospitals, roads and businesses, and hundreds of millions to help those who've been displaced. That's why we are providing more than $2.8 billion to help Afghans develop their economy and deliver services that people depend on.	Nous savons en outre que la puissance militaire ne va pas à elle seule résoudre les problèmes qui se posent en Afghanistan et au Pakistan. C'est pour cette raison que nous comptons investir 1,5 milliard de dollars par an, au cours des cinq prochaines années, dans la construction d'écoles et d'hôpitaux, de routes et d'entreprises, en partenariat avec les Pakistanais, ainsi que des centaines de millions de dollars pour venir en aide aux personnes déplacées. C'est pour cette raison encore que nous fournissons plus de 2,8 milliards de dollars aux Afghans afin de les aider à développer leur économie et à prodiguer les services dont la population a besoin.	También sabemos que el poderío militar por sí solo no va a resolver los problemas en Afganistán y Pakistán. Por eso planeamos invertir $1,500 millones de dólares cada uno de los próximos cinco años, a fin de asociarnos con Pakistán para construir escuelas y hospitales, carreteras y empresas, y cientos de millones para ayudar a quienes han sido desplazados. Por eso estamos proporcionando más de $2,800 millones para ayudar al pueblo de Afganistán a desarrollar su economía y prestar servicios de los que depende la gente.
Let me also address the issue of Iraq. Unlike Afghanistan, Iraq was a war of choice that provoked strong differences in my country and around the world. Although I believe that the Iraqi people are ultimately better off without the tyranny of Saddam Hussein, I also believe that events in Iraq have reminded America of the need to use diplomacy and build international consensus to resolve our problems whenever possible. (Applause.) Indeed, we can recall the words of Thomas Jefferson, who said: "I hope that our wisdom will grow with our power, and teach us that the less we use our power the greater it will be."	Je voudrais aussi aborder le dossier de l'Irak. Contrairement à la guerre en Afghanistan, la guerre en Irak est le résultat d'un choix, lequel a provoqué des différences marquées dans mon pays et à travers le monde. Tout en étant convaincu que le peuple irakien a gagné au bout du compte à être libéré de la tyrannie de Saddam Hussein, je crois aussi que les événements en Irak ont rappelé à l'Amérique la nécessité de recourir à la diplomatie et de construire un consensus international pour résoudre ses problèmes à chaque fois que c'est possible. (Applaudissements) De fait, nous avons en mémoire les propos de Thomas Jefferson, qui disait ceci : « J'espère que notre sagesse grandira avec notre puissance et qu'elle nous enseignera que moins nous utiliserons cette dernière, plus elle fera de l'effet. »	Permítanme también hablar del tema de Irak. A diferencia de Afganistán, nosotros elegimos ir a la guerra en Irak, y eso provocó fuerte antagonismo en mi país y alrededor del mundo. Aunque creo que, a fin de cuentas, el pueblo iraquí está mejor sin la tiranía de Sadam Husein, también creo que los acontecimientos en Irak han recordado a los Estados Unidos de Norteamerica que es necesario usar la diplomacia y promover consenso a nivel internacional para resolver nuestros problemas cuando sea posible. De hecho, podemos citar las palabras de Thomas Jefferson, quien dijo: “Espero que nuestra sabiduría aumente con nuestro poder y nos enseñe que cuanto menos usemos nuestro poder, éste se incrementará”.
Today, America has a dual responsibility: to help Iraq forge a better future -- and to leave Iraq to Iraqis. And I have made it clear to the Iraqi people -- (applause) -- I have made it clear to the Iraqi people that we pursue no bases, and no claim on their territory or resources. Iraq's sovereignty is its own. And that's why I ordered the removal of our combat brigades by next August. That is why we will honor our agreement with Iraq's democratically elected government to remove combat troops from Iraqi cities by July, and to remove all of our troops from Iraq by 2012. (Applause.) We will help Iraq train its security forces and develop its economy. But we will support a secure and united Iraq as a partner, and never as a patron.	Aujourd'hui, l'Amérique possède une double responsabilité : aider l'Irak à se forger un avenir meilleur et laisser l'Irak aux Irakiens. J'ai fait clairement savoir au peuple irakien (Applaudissements) que nous ne cherchons nullement à établir des bases en Irak ni à revendiquer son territoire ou ses ressources. La souveraineté de l'Irak appartient à l'Irak. C'est pour cette raison que j'ai ordonné le retrait de nos brigades de combat d'ici au mois d'août de l'année prochaine. C'est pour cette raison que nous allons honorer l'accord que nous avons conclu avec le gouvernement irakien, élu démocratiquement, concernant le retrait de nos troupes de combat des villes irakiennes d'ici au mois de juillet et de toutes nos troupes du territoire irakien d'ici à 2012. (Applaudissements) Nous aiderons l'Irak à former ses forces de sécurité et à développer son économie. Mais c'est en tant que partenaires, et jamais en tant que protecteurs, que nous apporterons notre appui à un Irak sécurisé et uni.	Hoy, Estados Unidos tiene una doble responsabilidad: ayudar a Irak a forjar un mejor futuro y a dejar Irak en manos de los iraquíes. Le he dicho claramente al pueblo iraquí que no queremos bases militares y no queremos reclamar ninguna parte de su territorio ni de sus recursos. La soberanía de Irak es toda suya. Por eso ordené el retorno de nuestras brigadas de combate para el próximo agosto. Por eso cumpliremos con nuestro acuerdo con el gobierno de Irak, democráticamente elegido, de retirar nuestras tropas de combate de las ciudades iraquíes para julio y de retirar todas nuestras tropas de Irak para el 2012. Ayudaremos a Irak a capacitar a sus Fuerzas de Seguridad y a desarrollar su economía. Respaldaremos, como socio y jamás como patrón, a un Irak seguro y unido.
And finally, just as America can never tolerate violence by extremists, we must never alter or forget our principles. Nine-eleven was an enormous trauma to our country. The fear and anger that it provoked was understandable, but in some cases, it led us to act contrary to our traditions and our ideals. We are taking concrete actions to change course. I have unequivocally prohibited the use of torture by the United States, and I have ordered the prison at Guantanamo Bay closed by early next year. (Applause.)	Enfin, tout comme l'Amérique ne tolérera jamais la violence des extrémistes, elle ne doit jamais altérer ni oublier ses principes. Les événements du 11 Septembre ont infligé un traumatisme considérable à notre pays. La peur et la colère qu'ils ont provoquées sont compréhensibles, mais dans certains cas ces sentiments nous ont conduits à agir de manière contraire à nos traditions et à nos idéaux. Nous prenons maintenant des mesures concrètes pour rectifier cette situation. J'ai interdit sans équivoque l'usage de la torture par les États-Unis et j'ai ordonné la fermeture de la prison à Guantanamo Bay d'ici au début de l'année prochaine. (Applaudissements)	Y finalmente, así como Estados Unidos no puede tolerar la violencia a manos de extremistas, nunca debemos cambiar nuestros principios. El 11 de septiembre fue un trauma enorme para nuestro país. El temor y la ira que causó son comprensibles, pero en algunos casos, nos llevó a actuar en contra de nuestros ideales. Estamos tomando medidas concretas para cambiar de curso. He prohibido inequívocamente el uso de tortura por Estados Unidos y he ordenado que se clausure la prisión en la bahía de Guantánamo para comienzos del próximo año.
So America will defend itself, respectful of the sovereignty of nations and the rule of law. And we will do so in partnership with Muslim communities which are also threatened. The sooner the extremists are isolated and unwelcome in Muslim communities, the sooner we will all be safer.	L'Amérique va donc se défendre, dans le respect de la souveraineté des nations et de la primauté du droit. Et nous agirons en ce sens en partenariat avec les communautés musulmanes qui sont elles aussi menacées. Plus vite les extrémistes seront isolés et malvenus dans les communautés musulmanes, plus vite nous connaîtrons tous une sécurité accrue.	Entonces, Estados Unidos se defenderá, respetuoso de la soberanía de las naciones y el imperio de la ley. Y lo haremos en alianza con las comunidades musulmanas que también se ven amenazadas. Cuanto antes se aísle a los extremistas y no se les acepte en las comunidades musulmanas, más pronto estaremos todos más seguros.
The second major source of tension that we need to discuss is the situation between Israelis, Palestinians and the Arab world.	La deuxième grande source de tension que nous devons aborder concerne la situation entre les Israéliens, les Palestiniens et le monde arabe.	La segunda fuente importante de tensión que necesitamos discutir es la situación entre los israelíes, palestinos y el mundo árabe.
America's strong bonds with Israel are well known. This bond is unbreakable. It is based upon cultural and historical ties, and the recognition that the aspiration for a Jewish homeland is rooted in a tragic history that cannot be denied.	Les liens solides qui unissent l'Amérique à Israël sont bien connus. Cette relation est immuable. Elle se fonde sur des liens culturels et historiques et sur la reconnaissance du fait que l'aspiration à un territoire juif est ancré dans un passé tragique indéniable.	Los estrechos vínculos de Estados Unidos con Israel son muy conocidos. Este vínculo es inquebrantable. Se basa en lazos culturales e históricos, y el reconocimiento de que el anhelo de un territorio judío está arraigado en una historia trágica que no se puede negar.
